{
  "action": {
    "check_type": "DeviceID",
    "check_value": "did",
    "decision": "review",
    "ttl": 300
  },
  "app": "nebula",
  "category": "ACCOUNT",
  "condition": {
    "conditions": [
      {
        "left": {
          "field": "page",
          "kind": "event_field"
        },
        "op": "!regex",
        "right": {
          "kind": "constant",
          "value": "^\\s*$"
        }
      },
      {
        "left": {
          "counter": {
            "algorithm": "count",
            "event": "HTTP_DYNAMIC",
            "filter": {
              "object": "page",
              "operation": "contains",
              "type": "simple",
              "value": "<YOUR_PAYMENT_PAGE_PATH>"
            },
            "groupby": [
              "did"
            ],
            "operand": [
              "c_ip"
            ],
            "window": 300
          },
          "kind": "counter"
        },
        "op": "==",
        "right": {
          "kind": "constant",
          "value": "0"
        }
      }
    ],
    "op": "and"
  },
  "effective_from": 1504001710079,
  "effective_to": null,
  "explain": true,
  "name": "设备请求登录前未访问必要资源",
  "remark": "login, no xxx in 5m",
  "score": 0,
  "source_1x": {
    "group_id": 2,
    "is_locked": false
  },
  "status": "test",
  "tags": [
    "跳跃访问"
  ],
  "trigger": {
    "event": "ACCOUNT_LOGIN"
  },
  "version": "2.0",
  "visible_name": "设备请求登录前未访问必要资源"
}
