{
  "action": {
    "check_type": "IP",
    "check_value": "c_ip",
    "decision": "review",
    "ttl": 300
  },
  "app": "nebula",
  "category": "VISITOR",
  "condition": {
    "conditions": [
      {
        "left": {
          "field": "c_ip",
          "kind": "event_field"
        },
        "op": "contains",
        "right": {
          "kind": "constant",
          "value": "."
        }
      },
      {
        "left": {
          "field": "method",
          "kind": "event_field"
        },
        "op": "==",
        "right": {
          "kind": "constant",
          "value": "POST"
        }
      },
      {
        "left": {
          "field": "uri_query",
          "kind": "event_field"
        },
        "op": "regex",
        "right": {
          "kind": "constant",
          "value": "\\.\\.|/etc/passwd|c:\\\\\\\\|cmd\\.exe|\\\\\\\\|/"
        }
      }
    ],
    "op": "and"
  },
  "effective_from": 1477984830403,
  "effective_to": null,
  "explain": true,
  "name": "visit_directory_traversal_post_ip",
  "remark": "POST参数中包含目录遍历的特征",
  "score": 0,
  "source_1x": {
    "group_id": 2,
    "is_locked": false
  },
  "status": "test",
  "tags": [
    "目录遍历"
  ],
  "trigger": {
    "event": "HTTP_DYNAMIC"
  },
  "version": "2.0",
  "visible_name": "visit_directory_traversal_post_ip"
}
