{
  "action": {
    "check_type": "DeviceID",
    "check_value": "did",
    "decision": "review",
    "ttl": 300
  },
  "app": "nebula",
  "category": "ORDER",
  "condition": {
    "conditions": [
      {
        "left": {
          "field": "uid",
          "kind": "event_field"
        },
        "op": "!regex",
        "right": {
          "kind": "constant",
          "value": "^\\s*$"
        }
      },
      {
        "left": {
          "counter": {
            "algorithm": "distinct_count",
            "event": "ORDER_SUBMIT",
            "groupby": [
              "did"
            ],
            "operand": [
              "receiver_mobile"
            ],
            "window": 3600
          },
          "kind": "counter"
        },
        "op": "==",
        "right": {
          "kind": "constant",
          "value": "1"
        }
      },
      {
        "left": {
          "counter": {
            "algorithm": "count",
            "event": "ORDER_SUBMIT",
            "groupby": [
              "did"
            ],
            "operand": [
              "c_ip"
            ],
            "window": 3600
          },
          "kind": "counter"
        },
        "op": ">",
        "right": {
          "kind": "constant",
          "value": "5"
        }
      }
    ],
    "op": "and"
  },
  "effective_from": 1482826795423,
  "effective_to": null,
  "explain": true,
  "name": "设备多次请求下单__同手机号",
  "remark": ">5 in 1h, receiver_mobile",
  "score": 0,
  "source_1x": {
    "group_id": 2,
    "is_locked": false
  },
  "status": "test",
  "tags": [
    "单一下单"
  ],
  "trigger": {
    "event": "ORDER_SUBMIT"
  },
  "version": "2.0",
  "visible_name": "设备多次请求下单__同手机号"
}
