{
  "action": {
    "check_type": "IP",
    "check_value": "c_ip",
    "decision": "review",
    "ttl": 300
  },
  "app": "nebula",
  "category": "ACCOUNT",
  "condition": {
    "conditions": [
      {
        "left": {
          "field": "page",
          "kind": "event_field"
        },
        "op": "!regex",
        "right": {
          "kind": "constant",
          "value": "^\\s*$"
        }
      },
      {
        "left": {
          "counter": {
            "algorithm": "count",
            "event": "ACCOUNT_LOGIN",
            "filter": {
              "object": "page",
              "operation": "!regex",
              "type": "simple",
              "value": "^\\s*$"
            },
            "groupby": [
              "c_ip"
            ],
            "operand": [
              "c_ip"
            ],
            "window": 1800
          },
          "kind": "counter"
        },
        "op": ">",
        "right": {
          "kind": "constant",
          "value": "5"
        }
      },
      {
        "left": {
          "counter": {
            "algorithm": "distinct_count",
            "event": "HTTP_DYNAMIC",
            "groupby": [
              "c_ip"
            ],
            "operand": [
              "page"
            ],
            "window": 1800
          },
          "kind": "counter"
        },
        "op": "<=",
        "right": {
          "kind": "constant",
          "value": "4"
        }
      }
    ],
    "op": "and"
  },
  "effective_from": 1484040852259,
  "effective_to": null,
  "explain": true,
  "name": "设备集中请求登录",
  "remark": ">5 ，页面<=4 in 30min",
  "score": 0,
  "source_1x": {
    "group_id": 2,
    "is_locked": false
  },
  "status": "test",
  "tags": [
    "高频登录"
  ],
  "trigger": {
    "event": "ACCOUNT_LOGIN"
  },
  "version": "2.0",
  "visible_name": "设备集中请求登录"
}
