{
  "action": {
    "check_type": "USER",
    "check_value": "uid",
    "decision": "review",
    "ttl": 3600
  },
  "app": "nebula",
  "category": "ORDER",
  "condition": {
    "conditions": [
      {
        "left": {
          "field": "page",
          "kind": "event_field"
        },
        "op": "!regex",
        "right": {
          "kind": "constant",
          "value": "^\\s*$"
        }
      },
      {
        "left": {
          "counter": {
            "algorithm": "distinct_count",
            "event": "ORDER_CANCEL",
            "filter": {
              "object": "page",
              "operation": "!regex",
              "type": "simple",
              "value": "^\\s*$"
            },
            "groupby": [
              "uid"
            ],
            "operand": [
              "order_id"
            ],
            "window": 1800
          },
          "kind": "counter"
        },
        "op": ">",
        "right": {
          "kind": "constant",
          "value": "3"
        }
      }
    ],
    "op": "and"
  },
  "effective_from": 1502889958243,
  "effective_to": null,
  "explain": true,
  "name": "用户多次取消订单",
  "remark": ">3 in 30min distinct orderid",
  "score": 0,
  "source_1x": {
    "group_id": 2,
    "is_locked": false
  },
  "status": "test",
  "tags": [
    "取消订单"
  ],
  "trigger": {
    "event": "ORDER_CANCEL"
  },
  "version": "2.0",
  "visible_name": "用户多次取消订单"
}
