{
  "action": {
    "check_type": "IP",
    "check_value": "c_ip",
    "decision": "review",
    "ttl": 3600
  },
  "app": "nebula",
  "category": "ORDER",
  "condition": {
    "conditions": [
      {
        "left": {
          "field": "page",
          "kind": "event_field"
        },
        "op": "!regex",
        "right": {
          "kind": "constant",
          "value": "^\\s*$"
        }
      },
      {
        "left": {
          "counter": {
            "algorithm": "distinct_count",
            "event": "ORDER_SUBMIT",
            "filter": {
              "object": "page",
              "operation": "!regex",
              "type": "simple",
              "value": "^\\s*$"
            },
            "groupby": [
              "c_ip"
            ],
            "operand": [
              "order_id"
            ],
            "window": 1800
          },
          "kind": "counter"
        },
        "op": ">",
        "right": {
          "kind": "constant",
          "value": "4"
        }
      },
      {
        "left": {
          "counter": {
            "algorithm": "count",
            "event": "HTTP_DYNAMIC",
            "filter": {
              "object": "page",
              "operation": "contains",
              "type": "simple",
              "value": "<YOUR_PAYMENT_PAGE_PATH>"
            },
            "groupby": [
              "c_ip"
            ],
            "operand": [
              "c_ip"
            ],
            "window": 1800
          },
          "kind": "counter"
        },
        "op": "==",
        "right": {
          "kind": "constant",
          "value": "0"
        }
      }
    ],
    "op": "and"
  },
  "effective_from": 1502889958243,
  "effective_to": null,
  "explain": true,
  "name": "IP下单不支付",
  "remark": ">4 in 30min no pay",
  "score": 0,
  "source_1x": {
    "group_id": 2,
    "is_locked": false
  },
  "status": "test",
  "tags": [
    "下单不支付"
  ],
  "trigger": {
    "event": "ORDER_SUBMIT"
  },
  "version": "2.0",
  "visible_name": "IP下单不支付"
}
