{
  "action": {
    "check_type": "IP",
    "check_value": "c_ip",
    "decision": "review",
    "ttl": 300
  },
  "app": "nebula",
  "category": "VISITOR",
  "condition": {
    "conditions": [
      {
        "left": {
          "field": "method",
          "kind": "event_field"
        },
        "op": "==",
        "right": {
          "kind": "constant",
          "value": "GET"
        }
      },
      {
        "left": {
          "keys": [
            "c_ip"
          ],
          "kind": "variable",
          "variable": "ip__visit_dynamic_count__5m__rt"
        },
        "op": ">",
        "right": {
          "kind": "constant",
          "value": "30"
        }
      },
      {
        "left": {
          "keys": [
            "c_ip"
          ],
          "kind": "variable",
          "variable": "ip__visit_dynamic_get_ratio__5m__rt"
        },
        "op": "==",
        "right": {
          "kind": "constant",
          "value": "1"
        }
      }
    ],
    "op": "and"
  },
  "effective_from": 1484104685827,
  "effective_to": null,
  "explain": true,
  "name": "IP大量连续GET请求",
  "remark": ">30 in 5m",
  "score": 0,
  "source_1x": {
    "group_id": 2,
    "is_locked": false
  },
  "status": "test",
  "tags": [
    "高频访问"
  ],
  "trigger": {
    "event": "HTTP_DYNAMIC"
  },
  "version": "2.0",
  "visible_name": "IP大量连续GET请求"
}
