{
  "action": {
    "check_type": "DeviceID",
    "check_value": "did",
    "decision": "review",
    "ttl": 300
  },
  "app": "nebula",
  "category": "ACCOUNT",
  "condition": {
    "conditions": [
      {
        "left": {
          "field": "page",
          "kind": "event_field"
        },
        "op": "!regex",
        "right": {
          "kind": "constant",
          "value": "^\\s*$"
        }
      },
      {
        "left": {
          "keys": [
            "did"
          ],
          "kind": "variable",
          "variable": "did__account_login_distinct_count_uid__5m__rt"
        },
        "op": ">",
        "right": {
          "kind": "constant",
          "value": "3"
        }
      },
      {
        "left": {
          "keys": [
            "did"
          ],
          "kind": "variable",
          "variable": "did__account_login_distinct_count_password__5m__rt"
        },
        "op": "==",
        "right": {
          "kind": "constant",
          "value": "1"
        }
      }
    ],
    "op": "and"
  },
  "effective_from": 1484040852259,
  "effective_to": null,
  "explain": true,
  "name": "设备相同密码请求登录不同账号",
  "remark": ">3 in 5min",
  "score": 0,
  "source_1x": {
    "group_id": 2,
    "is_locked": false
  },
  "status": "test",
  "tags": [
    "高频登录"
  ],
  "trigger": {
    "event": "ACCOUNT_LOGIN"
  },
  "version": "2.0",
  "visible_name": "设备相同密码请求登录不同账号"
}
