{
  "action": {
    "check_type": "USER",
    "check_value": "uid",
    "decision": "review",
    "ttl": 300
  },
  "app": "nebula",
  "category": "ORDER",
  "condition": {
    "conditions": [
      {
        "left": {
          "field": "page",
          "kind": "event_field"
        },
        "op": "!regex",
        "right": {
          "kind": "constant",
          "value": "^\\s*$"
        }
      },
      {
        "left": {
          "field": "order_money_amount",
          "kind": "event_field"
        },
        "op": "<=",
        "right": {
          "kind": "constant",
          "value": "100"
        }
      },
      {
        "left": {
          "counter": {
            "algorithm": "count",
            "event": "ORDER_SUBMIT",
            "filter": {
              "condition": [
                {
                  "object": "page",
                  "operation": "!regex",
                  "type": "simple",
                  "value": "^\\s*$"
                },
                {
                  "object": "order_money_amount",
                  "operation": "<=",
                  "type": "simple",
                  "value": "100"
                }
              ],
              "type": "and"
            },
            "groupby": [
              "uid"
            ],
            "operand": [
              "c_ip"
            ],
            "window": 3600
          },
          "kind": "counter"
        },
        "op": ">",
        "right": {
          "kind": "constant",
          "value": "5"
        }
      }
    ],
    "op": "and"
  },
  "effective_from": 1482826795423,
  "effective_to": null,
  "explain": true,
  "name": "用户多次请求下单__金额较低",
  "remark": ">5 in 1h, order_money_amount<= 100",
  "score": 0,
  "source_1x": {
    "group_id": 2,
    "is_locked": false
  },
  "status": "test",
  "tags": [
    "单一下单"
  ],
  "trigger": {
    "event": "ORDER_SUBMIT"
  },
  "version": "2.0",
  "visible_name": "用户多次请求下单__金额较低"
}
