{
  "action": {
    "check_type": "USER",
    "check_value": "uid",
    "decision": "review",
    "ttl": 300
  },
  "app": "nebula",
  "category": "ORDER",
  "condition": {
    "conditions": [
      {
        "left": {
          "field": "uid",
          "kind": "event_field"
        },
        "op": "!regex",
        "right": {
          "kind": "constant",
          "value": "^\\s*$"
        }
      },
      {
        "left": {
          "field": "page",
          "kind": "event_field"
        },
        "op": "!regex",
        "right": {
          "kind": "constant",
          "value": "^\\s*$"
        }
      },
      {
        "left": {
          "counter": {
            "algorithm": "distinct_count",
            "event": "ORDER_SUBMIT",
            "filter": {
              "object": "page",
              "operation": "!regex",
              "type": "simple",
              "value": "^\\s*$"
            },
            "groupby": [
              "uid"
            ],
            "operand": [
              "receiver_address_detail"
            ],
            "window": 3600
          },
          "kind": "counter"
        },
        "op": ">",
        "right": {
          "kind": "constant",
          "value": "2"
        }
      }
    ],
    "op": "and"
  },
  "effective_from": 1482826795423,
  "effective_to": null,
  "explain": true,
  "name": "用户多次请求下单__不同地址",
  "remark": ">2 in 1h, receiver_address_detail",
  "score": 0,
  "source_1x": {
    "group_id": 2,
    "is_locked": false
  },
  "status": "test",
  "tags": [
    "不同下单"
  ],
  "trigger": {
    "event": "ORDER_SUBMIT"
  },
  "version": "2.0",
  "visible_name": "用户多次请求下单__不同地址"
}
