{
  "action": {
    "check_type": "IP",
    "check_value": "c_ip",
    "decision": "review",
    "ttl": 300
  },
  "app": "nebula",
  "category": "VISITOR",
  "condition": {
    "left": {
      "field": "s_bytes",
      "kind": "event_field"
    },
    "op": ">",
    "right": {
      "kind": "constant",
      "value": "5242880"
    }
  },
  "effective_from": 1477908654360,
  "effective_to": null,
  "explain": true,
  "name": "IP响应字节过大",
  "remark": "> 5M",
  "score": 0,
  "source_1x": {
    "group_id": 2,
    "is_locked": false
  },
  "status": "test",
  "tags": [
    "恶意扫描"
  ],
  "trigger": {
    "event": "HTTP_DYNAMIC"
  },
  "version": "2.0",
  "visible_name": "IP响应字节过大"
}
