{
  "action": {
    "check_type": "DeviceID",
    "check_value": "did",
    "decision": "review",
    "ttl": 300
  },
  "app": "nebula",
  "category": "ACCOUNT",
  "condition": {
    "conditions": [
      {
        "left": {
          "field": "did",
          "kind": "event_field"
        },
        "op": "!regex",
        "right": {
          "kind": "constant",
          "value": "^\\s*$"
        }
      },
      {
        "left": {
          "keys": [
            "did"
          ],
          "kind": "variable",
          "variable": "did__account_dynamic_distinct_count_geo_city__5m__rt"
        },
        "op": ">",
        "right": {
          "kind": "constant",
          "value": "2"
        }
      }
    ],
    "op": "and"
  },
  "effective_from": 1484043201651,
  "effective_to": null,
  "explain": true,
  "name": "设备关联多个IP地域",
  "remark": ">2 in 5m",
  "score": 0,
  "source_1x": {
    "group_id": 2,
    "is_locked": false
  },
  "status": "test",
  "tags": [
    "高频关联"
  ],
  "trigger": {
    "event": "HTTP_DYNAMIC"
  },
  "version": "2.0",
  "visible_name": "设备关联多个IP地域"
}
