{
  "action": {
    "check_type": "IP",
    "check_value": "c_ip",
    "decision": "review",
    "ttl": 300
  },
  "app": "nebula",
  "category": "VISITOR",
  "condition": {
    "conditions": [
      {
        "left": {
          "field": "page",
          "kind": "event_field"
        },
        "op": "contains",
        "right": {
          "kind": "constant",
          "value": "sign"
        }
      },
      {
        "left": {
          "counter": {
            "algorithm": "count",
            "event": "HTTP_DYNAMIC",
            "filter": {
              "object": "page",
              "operation": "contains",
              "type": "simple",
              "value": "sign"
            },
            "groupby": [
              "c_ip"
            ],
            "operand": [
              "c_ip"
            ],
            "window": 300
          },
          "kind": "counter"
        },
        "op": ">",
        "right": {
          "kind": "constant",
          "value": "5"
        }
      }
    ],
    "op": "and"
  },
  "effective_from": 1484102697103,
  "effective_to": null,
  "explain": true,
  "name": "IP大量请求签到接口",
  "remark": ">5 in 5m 不需要解析 sign",
  "score": 0,
  "source_1x": {
    "group_id": 2,
    "is_locked": false
  },
  "status": "test",
  "tags": [
    "高频访问"
  ],
  "trigger": {
    "event": "HTTP_DYNAMIC"
  },
  "version": "2.0",
  "visible_name": "IP大量请求签到接口"
}
