{
  "action": {
    "check_type": "DeviceID",
    "check_value": "did",
    "decision": "review",
    "ttl": 300
  },
  "app": "nebula",
  "category": "ACCOUNT",
  "condition": {
    "conditions": [
      {
        "left": {
          "field": "page",
          "kind": "event_field"
        },
        "op": "!regex",
        "right": {
          "kind": "constant",
          "value": "^\\s*$"
        }
      },
      {
        "left": {
          "field": "result",
          "kind": "event_field"
        },
        "op": "==",
        "right": {
          "kind": "constant",
          "value": "F"
        }
      },
      {
        "left": {
          "counter": {
            "algorithm": "count",
            "event": "ACCOUNT_LOGIN",
            "filter": {
              "condition": [
                {
                  "object": "result",
                  "operation": "==",
                  "type": "simple",
                  "value": "F"
                },
                {
                  "object": "page",
                  "operation": "!regex",
                  "type": "simple",
                  "value": "^\\s*$"
                }
              ],
              "type": "and"
            },
            "groupby": [
              "did"
            ],
            "operand": [
              "c_ip"
            ],
            "window": 600
          },
          "kind": "counter"
        },
        "op": ">",
        "right": {
          "kind": "constant",
          "value": "5"
        }
      }
    ],
    "op": "and"
  },
  "effective_from": 1484040852259,
  "effective_to": null,
  "explain": true,
  "name": "设备多次登录失败",
  "remark": ">5 in 10min F",
  "score": 0,
  "source_1x": {
    "group_id": 2,
    "is_locked": false
  },
  "status": "test",
  "tags": [
    "高频登录"
  ],
  "trigger": {
    "event": "ACCOUNT_LOGIN"
  },
  "version": "2.0",
  "visible_name": "设备多次登录失败"
}
